{
  "$schema": "https://json-schema.org/draft/2020-12/schema",
  "$id": "https://github.com/scriptorium-suite/scriptorium-spec/blob/main/schemas/parsed-paper/v1.json",
  "title": "Scriptorium Parsed Paper v1",
  "description": "The normalized, LOCAL parse output of one paper PDF, emitted by Steward `parse` (GROBID, with later optional rich parsers such as Docling / MinerU). A deterministic structured file — metadata + sections + reference list + figures/tables — that the read-paper skill, direction synthesis, and lineage consume as their anti-fabrication source of truth (figures/data/citations reference this file, never invented). Joined to the rest of the suite by `id` = the Better BibTeX citekey. All content arrays are OPTIONAL: a given parser may fill only a subset. Additive contract — supersedes nothing. See specs/literature-reading.md §2.",
  "type": "object",
  "required": ["schema_version", "id", "created"],
  "properties": {
    "schema_version": { "const": "parsed-paper/1.0" },
    "id": {
      "type": "string",
      "description": "Better BibTeX citekey — the universal join id across the suite (library-kb, reading-note, lineage, project linked_literature)."
    },
    "created": { "type": "string", "description": "ISO 8601 date or date-time when the parse was produced." },
    "parser": {
      "type": "string",
      "description": "Which local parser produced this file, e.g. \"grobid\" | \"docling\" | \"mineru\"."
    },
    "source_pdf": { "type": "string", "description": "Path to the source PDF that was parsed." },
    "metadata": {
      "type": "object",
      "description": "Bibliographic metadata extracted from the PDF (best-effort; the citekey in `id` is authoritative).",
      "properties": {
        "title": { "type": "string" },
        "authors": { "type": "array", "items": { "type": "string" } },
        "year": { "type": "string" },
        "doi": { "type": "string" },
        "abstract": { "type": "string" }
      }
    },
    "sections": {
      "type": "array",
      "description": "Body sections in reading order. OPTIONAL — filled when the parser extracts full text.",
      "items": {
        "type": "object",
        "properties": {
          "heading": { "type": "string" },
          "level": { "type": "integer", "description": "Heading depth (1 = top-level section)." },
          "text": { "type": "string" }
        }
      }
    },
    "references": {
      "type": "array",
      "description": "Parsed reference list — the edges Steward `lineage` walks for own-library lineage. OPTIONAL.",
      "items": {
        "type": "object",
        "properties": {
          "raw": { "type": "string", "description": "Raw reference string as parsed." },
          "title": { "type": "string" },
          "authors": { "type": "array", "items": { "type": "string" } },
          "year": { "type": "string" },
          "doi": { "type": "string" }
        }
      }
    },
    "figures": {
      "type": "array",
      "description": "Extracted figure descriptors (anti-fabrication: reading-note figures reference these by id). OPTIONAL.",
      "items": {
        "type": "object",
        "properties": {
          "id": { "type": "string" },
          "caption": { "type": "string" },
          "page": { "type": "integer" }
        }
      }
    },
    "tables": {
      "type": "array",
      "description": "Extracted table descriptors. OPTIONAL.",
      "items": {
        "type": "object",
        "properties": {
          "id": { "type": "string" },
          "caption": { "type": "string" },
          "n_rows": { "type": "integer" }
        }
      }
    }
  }
}
